{
  "schemaVersion": "incident-audit-v1",
  "tenantSequenceNo": 2,
  "eventId": "77777777-7777-4777-8777-777777777772",
  "organizationId": "11111111-1111-4111-8111-111111111111",
  "actorId": "44444444-4444-4444-8444-444444444444",
  "action": "INCIDENT_METADATA_PATCHED",
  "resourceType": "incident",
  "resourceId": "33333333-3333-4333-8333-333333333333",
  "operationId": "55555555-5555-4555-8555-555555555552",
  "occurredAt": "2030-01-01T00:05:00Z",
  "payload": {
    "eventId": "77777777-7777-4777-8777-777777777772",
    "organizationId": "11111111-1111-4111-8111-111111111111",
    "incidentId": "33333333-3333-4333-8333-333333333333",
    "projectId": "22222222-2222-4222-8222-222222222222",
    "incidentVersion": 1,
    "eventType": "INCIDENT_METADATA_PATCHED",
    "actorId": "44444444-4444-4444-8444-444444444444",
    "operationId": "55555555-5555-4555-8555-555555555552",
    "occurredAt": "2030-01-01T00:05:00Z",
    "reason": "Primary on-call accepted incident ownership.",
    "fromStatus": "OPEN",
    "toStatus": "OPEN",
    "rootCause": null,
    "resolutionSummary": null,
    "metadata": {
      "title": "Synthetic checkout error-rate spike",
      "summary": "Synthetic 5xx rate exceeded the deterministic test threshold.",
      "severity": "SEV2",
      "ownerId": "44444444-4444-4444-8444-444444444444"
    }
  },
  "previousDigest": "aaaaaaaaaaaaaaaaaaaaaaaaaaaaaaaaaaaaaaaaaaaaaaaaaaaaaaaaaaaaaaaa",
  "eventDigest": "bbbbbbbbbbbbbbbbbbbbbbbbbbbbbbbbbbbbbbbbbbbbbbbbbbbbbbbbbbbbbbbb"
}
