{
  "schemaVersion": "incident-audit-v1",
  "tenantSequenceNo": 1,
  "eventId": "77777777-7777-4777-8777-777777777771",
  "organizationId": "11111111-1111-4111-8111-111111111111",
  "actorId": "44444444-4444-4444-8444-444444444444",
  "action": "INCIDENT_CREATED",
  "resourceType": "incident",
  "resourceId": "33333333-3333-4333-8333-333333333333",
  "operationId": "55555555-5555-4555-8555-555555555551",
  "occurredAt": "2030-01-01T00:00:00Z",
  "payload": {
    "eventId": "77777777-7777-4777-8777-777777777771",
    "organizationId": "11111111-1111-4111-8111-111111111111",
    "incidentId": "33333333-3333-4333-8333-333333333333",
    "projectId": "22222222-2222-4222-8222-222222222222",
    "incidentVersion": 0,
    "eventType": "INCIDENT_CREATED",
    "actorId": "44444444-4444-4444-8444-444444444444",
    "operationId": "55555555-5555-4555-8555-555555555551",
    "occurredAt": "2030-01-01T00:00:00Z",
    "reason": "Operator opened an incident after validating the synthetic alert.",
    "fromStatus": null,
    "toStatus": "OPEN",
    "rootCause": null,
    "resolutionSummary": null
  },
  "previousDigest": null,
  "eventDigest": "aaaaaaaaaaaaaaaaaaaaaaaaaaaaaaaaaaaaaaaaaaaaaaaaaaaaaaaaaaaaaaaa"
}
